{
 "schema_version": "1.0.0",
 "generator": {
  "name": "scan2plan",
  "version": "0.1.0"
 },
 "tier": "lidar",
 "capture": {
  "name": "single_scan_with_ceiling",
  "source": "/Users/parv/Desktop/AppliedAIEnggProject/data/raw/single_scan_with_ceiling",
  "tier": "lidar",
  "n_frames": 9745,
  "duration_s": 214.9,
  "device_class": "iPhone/iPad Pro with LiDAR (Stray Scanner)"
 },
 "units": {
  "length": "m",
  "area": "m2"
 },
 "frame": {
  "description": "plan frame: gravity-aligned, x/y on the dominant wall axes, origin arbitrary",
  "bounds": [
   -0.744,
   -0.98,
   8.872,
   8.743
  ]
 },
 "property": {
  "n_rooms": 6,
  "floor_area_total": {
   "value": 49.8745,
   "unit": "m2",
   "sigma": 1.8586,
   "ci95": [
    46.2318,
    53.5173
   ],
   "observed": true,
   "method": "lidar:sum-room-areas"
  },
  "adjacency": [
   {
    "rooms": [
     "R2",
     "R3"
    ],
    "via": [
     "O1",
     "O3",
     "O5"
    ],
    "shared_wall": true
   },
   {
    "rooms": [
     "R4",
     "R6"
    ],
    "via": [
     "O2"
    ],
    "shared_wall": false
   },
   {
    "rooms": [
     "R2",
     "R5"
    ],
    "via": [
     "O4",
     "O6"
    ],
    "shared_wall": true
   },
   {
    "rooms": [
     "R1",
     "R3"
    ],
    "via": [],
    "shared_wall": true
   }
  ],
  "overlaps": [],
  "drift_correction": {
   "method": "submap pose graph: wall loop-closure + Manhattan yaw anchor + odometry prior + floor anchor",
   "enabled": false
  }
 },
 "rooms": [
  {
   "id": "R1",
   "type": "room",
   "polygon": [
    [
     -0.5864,
     -0.9796
    ],
    [
     -0.5864,
     1.9747
    ],
    [
     2.2856,
     1.9747
    ],
    [
     2.2856,
     -0.9796
    ]
   ],
   "floor_area": {
    "value": 8.4848,
    "unit": "m2",
    "sigma": 0.5919,
    "ci95": [
     7.3248,
     9.6448
    ],
    "observed": true,
    "method": "lidar:polygon-area-propagated"
   },
   "perimeter": {
    "value": 11.6527,
    "unit": "m",
    "sigma": 0.2871,
    "ci95": [
     11.09,
     12.2153
    ],
    "observed": true,
    "method": "lidar:perimeter"
   },
   "ceiling_height": {
    "value": 2.9741,
    "unit": "m",
    "sigma": 0.0126,
    "ci95": [
     2.9495,
     2.9987
    ],
    "observed": true,
    "method": "lidar:ceiling-plane minus floor-plane (ceiling coverage 164%)"
   },
   "walls": [
    {
     "id": "R1-W1",
     "start": [
      -0.5864,
      -0.9796
     ],
     "end": [
      -0.5864,
      1.9747
     ],
     "length": {
      "value": 2.9543,
      "unit": "m",
      "sigma": 0.1402,
      "ci95": [
       2.6795,
       3.2292
      ],
      "observed": true,
      "method": "lidar:face-to-face"
     },
     "face_sigma_m": 0.143,
     "bounded_by_wall_face": true,
     "openings": []
    },
    {
     "id": "R1-W2",
     "start": [
      -0.5864,
      1.9747
     ],
     "end": [
      2.2856,
      1.9747
     ],
     "length": {
      "value": 2.872,
      "unit": "m",
      "sigma": 0.1477,
      "ci95": [
       2.5825,
       3.1615
      ],
      "observed": true,
      "method": "lidar:face-to-face"
     },
     "face_sigma_m": 0.1001,
     "bounded_by_wall_face": true,
     "openings": []
    },
    {
     "id": "R1-W3",
     "start": [
      2.2856,
      1.9747
     ],
     "end": [
      2.2856,
      -0.9796
     ],
     "length": {
      "value": 2.9543,
      "unit": "m",
      "sigma": 0.1402,
      "ci95": [
       2.6795,
       3.2292
      ],
      "observed": true,
      "method": "lidar:face-to-face"
     },
     "face_sigma_m": 0.0352,
     "bounded_by_wall_face": true,
     "openings": []
    },
    {
     "id": "R1-W4",
     "start": [
      2.2856,
      -0.9796
     ],
     "end": [
      -0.5864,
      -0.9796
     ],
     "length": {
      "value": 2.872,
      "unit": "m",
      "sigma": 0.1477,
      "ci95": [
       2.5825,
       3.1615
      ],
      "observed": true,
      "method": "lidar:face-to-face"
     },
     "face_sigma_m": 0.0975,
     "bounded_by_wall_face": true,
     "openings": []
    }
   ]
  },
  {
   "id": "R2",
   "type": "room",
   "polygon": [
    [
     6.0737,
     0.2268
    ],
    [
     6.0737,
     0.8367
    ],
    [
     5.4182,
     0.8367
    ],
    [
     5.4182,
     2.9977
    ],
    [
     7.9415,
     2.9977
    ],
    [
     7.9415,
     3.8387
    ],
    [
     8.8723,
     3.8387
    ],
    [
     8.8723,
     0.2268
    ]
   ],
   "floor_area": {
    "value": 9.9538,
    "unit": "m2",
    "sigma": 0.6697,
    "ci95": [
     8.6412,
     11.2664
    ],
    "observed": true,
    "method": "lidar:polygon-area-propagated"
   },
   "perimeter": {
    "value": 14.132,
    "unit": "m",
    "sigma": 0.7035,
    "ci95": [
     12.7532,
     15.5107
    ],
    "observed": true,
    "method": "lidar:perimeter"
   },
   "ceiling_height": {
    "value": 3.0976,
    "unit": "m",
    "sigma": 0.013,
    "ci95": [
     3.0721,
     3.1231
    ],
    "observed": true,
    "method": "lidar:ceiling-plane minus floor-plane (ceiling coverage 165%)"
   },
   "walls": [
    {
     "id": "R2-W1",
     "start": [
      6.0737,
      0.2268
     ],
     "end": [
      6.0737,
      0.8367
     ],
     "length": {
      "value": 0.6099,
      "unit": "m",
      "sigma": 0.05,
      "ci95": [
       0.5119,
       0.7078
      ],
      "observed": true,
      "method": "lidar:face-to-face"
     },
     "face_sigma_m": 0.0352,
     "bounded_by_wall_face": true,
     "openings": [
      "O3"
     ]
    },
    {
     "id": "R2-W2",
     "start": [
      6.0737,
      0.8367
     ],
     "end": [
      5.4182,
      0.8367
     ],
     "length": {
      "value": 0.6555,
      "unit": "m",
      "sigma": 0.2282,
      "ci95": [
       0.2082,
       1.1028
      ],
      "observed": true,
      "method": "lidar:face-to-face"
     },
     "face_sigma_m": 0.0352,
     "bounded_by_wall_face": true,
     "openings": []
    },
    {
     "id": "R2-W3",
     "start": [
      5.4182,
      0.8367
     ],
     "end": [
      5.4182,
      2.9977
     ],
     "length": {
      "value": 2.161,
      "unit": "m",
      "sigma": 0.0854,
      "ci95": [
       1.9937,
       2.3283
      ],
      "observed": true,
      "method": "lidar:face-to-face"
     },
     "face_sigma_m": 0.2255,
     "bounded_by_wall_face": true,
     "openings": [
      "O5"
     ]
    },
    {
     "id": "R2-W4",
     "start": [
      5.4182,
      2.9977
     ],
     "end": [
      7.9415,
      2.9977
     ],
     "length": {
      "value": 2.5233,
      "unit": "m",
      "sigma": 0.3792,
      "ci95": [
       1.7802,
       3.2665
      ],
      "observed": true,
      "method": "lidar:face-to-freespace"
     },
     "face_sigma_m": 0.0773,
     "bounded_by_wall_face": true,
     "openings": []
    },
    {
     "id": "R2-W5",
     "start": [
      7.9415,
      2.9977
     ],
     "end": [
      7.9415,
      3.8387
     ],
     "length": {
      "value": 0.841,
      "unit": "m",
      "sigma": 0.3143,
      "ci95": [
       0.225,
       1.4571
      ],
      "observed": true,
      "method": "lidar:face-to-freespace"
     },
     "face_sigma_m": 0.3047,
     "bounded_by_wall_face": false,
     "openings": []
    },
    {
     "id": "R2-W6",
     "start": [
      7.9415,
      3.8387
     ],
     "end": [
      8.8723,
      3.8387
     ],
     "length": {
      "value": 0.9308,
      "unit": "m",
      "sigma": 0.3067,
      "ci95": [
       0.3296,
       1.5319
      ],
      "observed": true,
      "method": "lidar:face-to-freespace"
     },
     "face_sigma_m": 0.3047,
     "bounded_by_wall_face": false,
     "openings": [
      "O4"
     ]
    },
    {
     "id": "R2-W7",
     "start": [
      8.8723,
      3.8387
     ],
     "end": [
      8.8723,
      0.2268
     ],
     "length": {
      "value": 3.6119,
      "unit": "m",
      "sigma": 0.3071,
      "ci95": [
       3.0101,
       4.2137
      ],
      "observed": true,
      "method": "lidar:face-to-freespace"
     },
     "face_sigma_m": 0.0352,
     "bounded_by_wall_face": true,
     "openings": [
      "O6"
     ]
    },
    {
     "id": "R2-W8",
     "start": [
      8.8723,
      0.2268
     ],
     "end": [
      6.0737,
      0.2268
     ],
     "length": {
      "value": 2.7986,
      "unit": "m",
      "sigma": 0.0511,
      "ci95": [
       2.6985,
       2.8987
      ],
      "observed": true,
      "method": "lidar:face-to-face"
     },
     "face_sigma_m": 0.0354,
     "bounded_by_wall_face": true,
     "openings": []
    }
   ]
  },
  {
   "id": "R3",
   "type": "room",
   "polygon": [
    [
     2.4228,
     0.8367
    ],
    [
     2.4228,
     4.0022
    ],
    [
     2.1225,
     4.0022
    ],
    [
     2.1225,
     5.0325
    ],
    [
     5.3069,
     5.0325
    ],
    [
     5.3069,
     0.8367
    ]
   ],
   "floor_area": {
    "value": 12.4104,
    "unit": "m2",
    "sigma": 0.4634,
    "ci95": [
     11.5022,
     13.3187
    ],
    "observed": true,
    "method": "lidar:polygon-area-propagated"
   },
   "perimeter": {
    "value": 14.7603,
    "unit": "m",
    "sigma": 0.482,
    "ci95": [
     13.8156,
     15.705
    ],
    "observed": true,
    "method": "lidar:perimeter"
   },
   "ceiling_height": {
    "value": 2.4606,
    "unit": "m",
    "sigma": 0.0107,
    "ci95": [
     2.4397,
     2.4815
    ],
    "observed": true,
    "method": "lidar:ceiling-plane minus floor-plane (ceiling coverage 79%)"
   },
   "walls": [
    {
     "id": "R3-W1",
     "start": [
      2.4228,
      0.8367
     ],
     "end": [
      2.4228,
      4.0022
     ],
     "length": {
      "value": 3.1655,
      "unit": "m",
      "sigma": 0.1186,
      "ci95": [
       2.933,
       3.398
      ],
      "observed": true,
      "method": "lidar:face-to-face"
     },
     "face_sigma_m": 0.0352,
     "bounded_by_wall_face": true,
     "openings": []
    },
    {
     "id": "R3-W2",
     "start": [
      2.4228,
      4.0022
     ],
     "end": [
      2.1225,
      4.0022
     ],
     "length": {